00004149066	Comforty 	COMFORTY. Тумба-умывальник "Эдинбург-75" бетон светлый с черной столешницей, с раковиной COMFORTY T-Y9378	Тумбы-умывальники	24900	34800	Эдинбург	755	550	520	400	730	510	ВЛДСП	матовое	ВЛДСП	матовое	Бетон светлый	Санфарфор	Керамогранит		-	-	Нет	черный металл					-	Подвесная	Тумба	0,8	0,47	0,58	0,307	61,12		Раковина	0,52	0,16	0,43	11,52	0,036	4630015253663	Столешница	1,03	0,07	0,71	26,8	0,051	4630015259344	61,12	0,307	3	Россия	2 года	Название: Тумба-умывальник Артикул: Эдинбург 75 Варианты цвета корпуса и фасада: Бетон светлый Материал корпуса: влагостойкое ЛДСП Габариты (ШхВхГ): 755*550*520 мм Комплектация: накладная раковина Comforty T-Y9378, столешница и плинтус из черного керамогранита. Тумба оборудована большим выкатным ящиком. Пространство внутри ящика разделено специальным органайзером. Фасад ящика оборудован системой плавного закрывания.	https://www.domotex.ru/documents/Manual-Comforty01102019.pdf	http://www.domotex.ru/files/Schema_montazha_Edinburg75.pdf	https://disk.yandex.ru/d/6zyMUgChmmA5AQ	http://www.domotex.ru/upload/iblock/887/93n20nxg9ie8n0xjhg68g9346q7rw0t5.jpg	https://www.youtube.com/embed/Qp2SLBQ4N4M	https://cdn1.ozone.ru/s3/multimedia-n/6227153939.jpg	https://cdn1.ozone.ru/s3/multimedia-v/6227153947.jpg	https://cdn1.ozone.ru/s3/multimedia-y/6227153950.jpg	https://cdn1.ozone.ru/s3/multimedia-c/6227153928.jpg	https://cdn1.ozone.ru/s3/multimedia-y/6227153914.jpg	https://cdn1.ozone.ru/s3/multimedia-i/6227153934.jpg	https://cdn1.ozone.ru/s3/multimedia-0/6227153916.jpg	https://cdn1.ozone.ru/s3/multimedia-h/6227153933.jpg	https://cdn1.ozone.ru/s3/multimedia-j/6227153935.jpg	https://cdn1.ozone.ru/s3/multimedia-g/6227153932.jpg	https://cdn1.ozone.ru/s3/multimedia-6/6227153922.jpg	https://cdn1.ozone.ru/s3/multimedia-b/6227153927.jpg	https://cdn1.ozone.ru/s3/multimedia-d/6227153929.jpg	https://cdn1.ozone.ru/s3/multimedia-8/6227153924.jpg	https://cdn1.ozone.ru/s3/multimedia-f/6227153931.jpg
00004149881	Comforty 	COMFORTY. Тумба-умывальник "Эдинбург-90" бетон светлый с черной столешницей, с раковиной COMFORTY 78189	Тумбы-умывальники	29200	40800	Эдинбург	900	540	520	400	880	510					Бетон светлый		Керамогранит		-	-	-	-					-	-	Тумба	0,94	0,47	0,58	0,26	29,2		Раковина	0,64	0,4	0,14	11	0,036	4630015256596	Столешница	1,03	0,07	0,71	33,3	0,051	4630015258606	73,5	0,347	3	Россия	2 года	Название: Тумба-умывальник Артикул: Эдинбург 90 Варианты цвета корпуса и фасада: Бетон светлый Материал корпуса: влагостойкое ЛДСП Габариты (ШхВхГ): 900*540*520 мм Комплектация: с раковиной COMFORTY 78189, столешница и плинтус из черного керамогранита. Тумба оборудована большим выкатным ящиком и дополнительной боковой нишей. Пространство внутри ящика разделено специальным органайзером. За боковой створкой одна горизонтальная полка. Фасад ящика оборудован системой Push-to-Open (открытие при нажатии), у боковой створки петля с механизмами плавного закрывания. 	https://www.domotex.ru/documents/Manual-Comforty01102019.pdf	http://www.domotex.ru/files/Schema_montazha_Edinburg_90_2020_2.pdf	https://disk.yandex.ru/d/sWNA3h4MTPCvGQ	http://www.domotex.ru/upload/iblock/8d2/wru3dgu5ceuffka8qubx5r1lfyu45xhu.jpg	-	https://cdn1.ozone.ru/s3/multimedia-5/6227420537.jpg	https://cdn1.ozone.ru/s3/multimedia-2/6227420534.jpg	https://cdn1.ozone.ru/s3/multimedia-7/6227420539.jpg	https://cdn1.ozone.ru/s3/multimedia-9/6227420541.jpg	https://cdn1.ozone.ru/s3/multimedia-b/6227420543.jpg	https://cdn1.ozone.ru/s3/multimedia-c/6227420544.jpg	https://cdn1.ozone.ru/s3/multimedia-p/6227420557.jpg	https://cdn1.ozone.ru/s3/multimedia-d/6227420545.jpg	https://cdn1.ozone.ru/s3/multimedia-h/6227420549.jpg	https://cdn1.ozone.ru/s3/multimedia-l/6227420553.jpg	https://cdn1.ozone.ru/s3/multimedia-i/6227420550.jpg	https://cdn1.ozone.ru/s3/multimedia-m/6227420554.jpg			
00004147997	Comforty 	COMFORTY. Тумба-умывальник "Эдинбург-90" бетон светлый с черной столешницей, с раковиной COMFORTY T-Y9378	Тумбы-умывальники	29200	40800	Эдинбург	900	540	520	400	880	510	ВЛДСП	матовое	ВЛДСП	матовое	Бетон светлый	Санфарфор	Керамогранит		-	-	Нет	-					-	Подвесная	Тумба	0,94	0,47	0,58	0,26	29,2		Раковина	0,52	0,16	0,43	11,52	0,036	4630015253663	Столешница	1,03	0,07	0,71	33,3	0,051	4630015258606	74,02	0,347	3	Россия	2 года	Название: Тумба-умывальник Артикул: Эдинбург 90 Варианты цвета корпуса и фасада: Бетон светлый Материал корпуса: влагостойкое ЛДСП Габариты (ШхВхГ): 900*540*520 мм Комплектация: накладная раковина Comforty T-Y9378, столешница и плинтус из черного керамогранита. Тумба оборудована большим выкатным ящиком и дополнительной боковой нишей. Пространство внутри ящика разделено специальным органайзером. За боковой створкой одна горизонтальная полка. Фасад ящика оборудован системой Push-to-Open (открытие при нажатии), у боковой створки петля с механизмами плавного закрывания. 	https://www.domotex.ru/documents/Manual-Comforty01102019.pdf	http://www.domotex.ru/files/Informatsiya_dlya_montazha_komplekta_EDINBURG_90.pdf	https://disk.yandex.ru/d/vcR9TXEPcGvpoA	http://www.domotex.ru/upload/iblock/c20/755sup5bjzb15obpbeshfxlz2ucic4ci.jpg	https://www.youtube.com/embed/HDP6yGFF3Rs	https://cdn1.ozone.ru/s3/multimedia-3/6227154459.jpg	https://cdn1.ozone.ru/s3/multimedia-c/6227154432.jpg	https://cdn1.ozone.ru/s3/multimedia-4/6227154460.jpg	https://cdn1.ozone.ru/s3/multimedia-6/6227154462.jpg	https://cdn1.ozone.ru/s3/multimedia-7/6227154427.jpg	https://cdn1.ozone.ru/s3/multimedia-s/6227154448.jpg	https://cdn1.ozone.ru/s3/multimedia-x/6227154453.jpg	https://cdn1.ozone.ru/s3/multimedia-4/6227154424.jpg	https://cdn1.ozone.ru/s3/multimedia-9/6227154429.jpg	https://cdn1.ozone.ru/s3/multimedia-l/6227154441.jpg	https://cdn1.ozone.ru/s3/multimedia-5/6227154461.jpg	https://cdn1.ozone.ru/s3/multimedia-p/6227154445.jpg	https://cdn1.ozone.ru/s3/multimedia-g/6227154436.jpg	https://cdn1.ozone.ru/s3/multimedia-y/6227191318.jpg	
00004147998	Comforty 	COMFORTY. Шкаф-колонна "Эдинбург-40" бетон светлый	Шкаф-колонна	13800	19300	Эдинбург	400	1600	300				ВЛДСП	матовое	ВЛДСП	матовое	Бетон светлый				-	-	-	-	Hettich/Comforty	Hettich/Comforty	-	-	2 створки + 4 полочки	Подвесная	Шкаф-колонна	0,45	1,65	0,37	0,275	37,6	4630015259047	-	-	-	-	-	-	-	-	-	-	-	-	-	-	37,6	-	1	Россия	2 года	Название: Шкаф-колонна Артикул: Эдинбург 40 Варианты цвета: Бетон светлый Материал: влагостойкое ЛДСП Габариты ШхВхГ: 400*1600*300 Подвесная шкаф-колонна с двумя распашными дверцами. Створка оборудована петлями с системой плавного закрывания. За каждой створкой по две горизонтальные полки. Шкаф-колонна универсальна, может быть подвешена в правом и левом варианте.	https://www.domotex.ru/documents/Manual-Comforty01102019.pdf	0	https://disk.yandex.ru/d/QeZVnV2VzvixvQ	http://www.domotex.ru/upload/iblock/905/wa8bfgvq3s2kg28rxvglrhv2ib4j14pn.jpg	0	https://cdn1.ozone.ru/s3/multimedia-j/6227111023.jpg	https://cdn1.ozone.ru/s3/multimedia-t/6227111033.jpg	https://cdn1.ozone.ru/s3/multimedia-o/6227111028.jpg	https://cdn1.ozone.ru/s3/multimedia-k/6227111024.jpg	https://cdn1.ozone.ru/s3/multimedia-h/6227107817.jpg	https://cdn1.ozone.ru/s3/multimedia-3/6227107839.jpg	https://cdn1.ozone.ru/s3/multimedia-0/6227107836.jpg	https://cdn1.ozone.ru/s3/multimedia-p/6227111029.jpg							
00-00006136	Comforty 	Зеркало-шкаф "Лиссабон-90" дуб темный	Зеркало-шкаф	8500	11800	Лиссабон	900	700	153				ВЛДСП	матовое	ВЛДСП	матовое	Дуб темный			Нет	-	-	-	-	Hettich/Comforty	Hettich/Comforty	-	-	1 створка	Подвесной	Зеркало-шкаф	0,76	0,97	0,21	0,155	22	4630100142001	-	-	-	-	-	-	-	-	-	-	-	-	-	-	22	-	1	Россия	2 года	Название: Шкаф-зеркало Артикул: Лиссабон 90 Цвет: дуб темный Габариты (ШхВхГ): 900*700*153 мм. Высококачественное зеркальное полотно с амальгамой на основе серебра. Створка оснащена петлями с плавным закрыванием. Петли у створки снаружи. За створкой одна горизонтальная полка. На нижней внешней полке можно расположить принадлежности для умывания. Зеркало-шкаф универсально - может быть подвешено в правом и левом варианте.	https://www.domotex.ru/documents/Manual-Comforty01102019.pdf	0	https://disk.yandex.ru/d/Q_wiUzsPhuvFTA		0	https://cdn1.ozone.ru/s3/multimedia-9/6256777317.jpg	https://cdn1.ozone.ru/s3/multimedia-6/6256777314.jpg	https://cdn1.ozone.ru/s3/multimedia-8/6256777316.jpg	https://cdn1.ozone.ru/s3/multimedia-b/6256777319.jpg	https://cdn1.ozone.ru/s3/multimedia-c/6256777320.jpg	https://cdn1.ozone.ru/s3/multimedia-5/6256777313.jpg	https://cdn1.ozone.ru/s3/multimedia-m/6227164918.jpg	https://cdn1.ozone.ru/s3/multimedia-c/6139453356.jpg	https://cdn1.ozone.ru/s3/multimedia-7/6256777315.jpg						
00-00006558	Comforty 	Тумба-умывальник "Лиссабон-95" дуб темный с правой черной столешницей с раковиной COMFORTY 9111	Тумбы-умывальники	30300	42400	Лиссабон	945	390	520	270	945	500	ВЛДСП	матовое	ВЛДСП	матовое	Дуб темный	Санфарфор	Керамогранит		-	-	Нет	черный металл					1 выкатной ящик	Подвесной	Тумба	1,01	0,34	0,57	0,2	21		Раковина	0,42	0,15	0,42	8,7	0,027	4630015259474	Столешница	1,03	0,07	0,71	33,3	0,051	4630100142445	63	0,278	3	Россия	2 года	Название: Тумба-умывальник Артикул: Лиссабон 95 Варианты цвета корпуса и фасада: Дуб темный Материал корпуса: влагостойкое ЛДСП Варианты цвета каркаса: черный муар Материал каркаса: сталь Габариты (ШхВхГ): 945*390*520 мм Подвесная консольная тумба-умывальник в стиле лофт. В основе тумбы - каркас из стального профиля окрашенный в цвет черный муар. В каркас интегрирован боковой полотенцедержатель. Керамическая круглая раковина чаша установлена справа на столешнице из черного керамогранита. Боковые стенки и фасад ящика изготовлены из влагостойкого ЛДСП цвета Дуб темный. Ящик тумбы оборудован механизмом push-to-open - открытие при нажатии. Тумба выпускается с правым и левым расположением раковины. Комплектация: накладная раковина Comforty 9111, столешница и пристенный бортик из черного керамогранита, пристенный сифон. Тумба подготовлена для подключения водоснабжения снизу.	https://www.domotex.ru/documents/Manual-Comforty01102019.pdf	http://www.domotex.ru/files/Schema-montazha-Lisboa95_2.pdf	https://disk.yandex.ru/d/4oQTrUZzjaE_DQ	http://www.domotex.ru/upload/iblock/491/v7hjgcz3z0py87u62abvvvxwaqmvfgf1.jpg	https://www.youtube.com/embed/FoC5bSsVX5Y	https://cdn1.ozone.ru/s3/multimedia-i/6256779558.jpg	https://cdn1.ozone.ru/s3/multimedia-j/6227152243.jpg	https://cdn1.ozone.ru/s3/multimedia-l/6227152245.jpg	https://cdn1.ozone.ru/s3/multimedia-z/6227152259.jpg	https://cdn1.ozone.ru/s3/multimedia-h/6256779593.jpg	https://cdn1.ozone.ru/s3/multimedia-m/6227152246.jpg	https://cdn1.ozone.ru/s3/multimedia-o/6227152248.jpg	https://cdn1.ozone.ru/s3/multimedia-6/6227152266.jpg	https://cdn1.ozone.ru/s3/multimedia-5/6256779581.jpg	https://cdn1.ozone.ru/s3/multimedia-s/6227152252.jpg	https://cdn1.ozone.ru/s3/multimedia-2/6227152262.jpg	https://cdn1.ozone.ru/s3/multimedia-o/6256779528.jpg			
00-00006269	Comforty 	Тумба-умывальник "Лиссабон-95" дуб темный с левой черной столешницей с раковиной COMFORTY 9111	Тумбы-умывальники	30300	42400	Лиссабон	945	390	520	270	945	500	ВЛДСП	матовое	ВЛДСП	матовое	Дуб темный	Санфарфор	Керамогранит		-	-	Нет	черный металл					1 выкатной ящик	Подвесной	Тумба	1,01	0,34	0,57	0,2	21		Раковина	0,42	0,15	0,42	8,7	0,027	4630015259474	Столешница	1,03	0,07	0,71	33,3	0,051	4630100142452	63	0,278	3	Россия	2 года	Название: Тумба-умывальник Артикул: Лиссабон 95 Варианты цвета корпуса и фасада: Дуб темный Материал корпуса: влагостойкое ЛДСП Варианты цвета каркаса: черный муар Материал каркаса: сталь Габариты (ШхВхГ): 945*390*520 мм Подвесная консольная тумба-умывальник в стиле лофт. В основе тумбы - каркас из стального профиля окрашенный в цвет черный муар. В каркас интегрирован боковой полотенцедержатель. Керамическая круглая раковина чаша установлена слева на столешнице из черного керамогранита. Боковые стенки и фасад ящика изготовлены из влагостойкого ЛДСП цвета Дуб темный. Ящик тумбы оборудован механизмом push-to-open - открытие при нажатии. Тумба выпускается с правым и левым расположением раковины. Комплектация: накладная раковина Comforty 9111, столешница и пристенный бортик из черного керамогранита, пристенный сифон. Тумба подготовлена для подключения водоснабжения снизу.	https://www.domotex.ru/documents/Manual-Comforty01102019.pdf	http://www.domotex.ru/files/Schema-montazha-Lisboa95.pdf	https://disk.yandex.ru/d/iVb3r_oTk-IJkw	http://www.domotex.ru/upload/iblock/854/y08utz1uknwhqhwce5e51qv39lj3zzfd.jpg	https://www.youtube.com/embed/Ys1xPcfMJbI	https://cdn1.ozone.ru/s3/multimedia-q/6256778126.jpg	https://cdn1.ozone.ru/s3/multimedia-p/6256778125.jpg	https://cdn1.ozone.ru/s3/multimedia-k/6227164916.jpg	https://cdn1.ozone.ru/s3/multimedia-0/6256778136.jpg	https://cdn1.ozone.ru/s3/multimedia-n/6227164919.jpg	https://cdn1.ozone.ru/s3/multimedia-m/6227164918.jpg	https://cdn1.ozone.ru/s3/multimedia-l/6227164917.jpg	https://cdn1.ozone.ru/s3/multimedia-b/6256777319.jpg	https://cdn1.ozone.ru/s3/multimedia-c/6256777320.jpg	https://cdn1.ozone.ru/s3/multimedia-r/6256778127.jpg	https://cdn1.ozone.ru/s3/multimedia-7/6256777315.jpg	https://cdn1.ozone.ru/s3/multimedia-j/6227164915.jpg			
00-00006270	Comforty 	Шкаф-колонна "Лиссабон-40" дуб темный	Шкаф-колонна	12300	17100	Лиссабон	380	1100	260				ВЛДСП	матовое	ВЛДСП	матовое	Дуб темный				-	-	Нет	-	Hettich/Comforty	Hettich/Comforty	-	-	1 створка	Подвесной	Шкаф-колонна	0,4	1,15	0,3	0,138	20	4630100141875	-	-	-	-	-	-	-	-	-	-	-	-	-	-	20	-	1	Россия	2 года	Название: Шкаф-колонна Артикул: Лиссабон 40 Варианты цвета: Дуб темный Материал: влагостойкое ЛДСП Варианты цвета каркаса: черный муар Материал каркаса: сталь Габариты ШхВхГ: 380*1100*260 мм Подвесной шкаф - со створкой и пространством для открытого хранения. Фасад и корпус из влагостойкого ЛДСП. В основе металлическая рама из окрашенного в черный муар металла. Петли створки с механизмами плавного закрывания. Створка может быть подвешена с правым или левым расположением петель.	https://www.domotex.ru/documents/Manual-Comforty01102019.pdf	0	https://disk.yandex.ru/d/FVOnSyCOwHfATA	http://www.domotex.ru/upload/iblock/60d/9in6w4iarxo2sa9v9a7xawktu7ehh34v.jpg	0	https://cdn1.ozone.ru/s3/multimedia-f/6256778979.jpg	https://cdn1.ozone.ru/s3/multimedia-3/6139454031.jpg	https://cdn1.ozone.ru/s3/multimedia-x/6139454097.jpg	https://cdn1.ozone.ru/s3/multimedia-1/6139454101.jpg	https://cdn1.ozone.ru/s3/multimedia-g/6256778980.jpg	https://cdn1.ozone.ru/s3/multimedia-b/6256777319.jpg	https://cdn1.ozone.ru/s3/multimedia-c/6256777320.jpg	https://cdn1.ozone.ru/s3/multimedia-m/6227164918.jpg	https://cdn1.ozone.ru/s3/multimedia-m/6139454122.jpg	https://cdn1.ozone.ru/s3/multimedia-7/6256777315.jpg					
00-00006652	Comforty 	COMFORTY. Зеркало-шкаф "Вена-45" дуб дымчатый	Зеркало-шкаф	5400	7500	Вена	450	700	150				ВЛДСП	матовое			Дуб дымчатый			Нет	-	-	-	-	Hettich/Comforty	Hettich/Comforty	-	-	1 створка	Подвесной	Зеркало-шкаф	0,51	0,87	0,22	0,097	15,3	4630100142421	-	-	-	-	-	-	-	-	-	-	-	-	-	-	15,3	-	1	Россия	2 года	Название: Зеркало-шкаф Артикул: Вена-45 (правое/левое) универсальное Цвет: Дуб дымчатый Габариты ШхВхГ: 450х700х150 мм  Зеркальное высококачественное полотно с амальгамой на основе серебра. Створка оснащена петлями с системой плавного закрывания. За створкой одна полка.	https://www.domotex.ru/documents/Manual-Comforty01102019.pdf	0	https://disk.yandex.ru/d/sqgSwkQOxAQ0OA	http://www.domotex.ru/upload/iblock/2a0/ran08a5k3igyhvb8ruqkl5nvkm7hzutb.jpg	0	https://cdn1.ozone.ru/s3/multimedia-m/6227191882.jpg	https://cdn1.ozone.ru/s3/multimedia-l/6227191881.jpg	https://cdn1.ozone.ru/s3/multimedia-o/6227191884.jpg	https://cdn1.ozone.ru/s3/multimedia-w/6227191892.jpg	https://cdn1.ozone.ru/s3/multimedia-q/6227191886.jpg	https://cdn1.ozone.ru/s3/multimedia-s/6227191888.jpg	https://cdn1.ozone.ru/s3/multimedia-u/6227191890.jpg								
00-00006653	Comforty 	COMFORTY. Тумба-умывальник "Вена-45" дуб дымчатый с раковиной Адриана 45	Тумбы-умывальники	10000	13900	Вена	450	620	450	550	420	430	ВЛДСП	матовое	ВЛДСП	матовое	Дуб дымчатый	Санфарфор			-	-	Нет	-					1 створка	Подвесной	Тумба	0,49	0,62	0,49	0,149	13		Раковина	0,47	0,197	0,522	12,7	0,048	4640021624135	-	-	-	-	-	-	-	25,7	0,197	2	Россия	2 года	Название: Тумба-умывальник Артикул: Вена-45 Цвет: Дуб дымчатый Габариты ШхВхГ: 450х620х450 мм Комплектация: керамическая раковина Адриана 45 Подвесная тумба-умывальник оснащена створкой с системой Push-to-open (открытия от нажатия).	https://www.domotex.ru/documents/Manual-Comforty01102019.pdf	0	https://disk.yandex.ru/d/iIvUV-f2zaqHRA	http://www.domotex.ru/upload/iblock/6c9/c37z9v2ytfcnbk4gqrv5g0822oz6pede.jpg	https://www.youtube.com/embed/C9VRDI7pa9c	https://cdn1.ozone.ru/s3/multimedia-o/6227170212.jpg	https://cdn1.ozone.ru/s3/multimedia-d/6227170201.jpg	https://cdn1.ozone.ru/s3/multimedia-i/6227170206.jpg	https://cdn1.ozone.ru/s3/multimedia-n/6227170211.jpg	https://cdn1.ozone.ru/s3/multimedia-v/6227170219.jpg	https://cdn1.ozone.ru/s3/multimedia-f/6227170203.jpg	https://cdn1.ozone.ru/s3/multimedia-m/6227170210.jpg	https://cdn1.ozone.ru/s3/multimedia-t/6227170217.jpg	https://cdn1.ozone.ru/s3/multimedia-2/6227170226.jpg	https://cdn1.ozone.ru/s3/multimedia-s/6227170216.jpg	https://cdn1.ozone.ru/s3/multimedia-u/6227170218.jpg	https://cdn1.ozone.ru/s3/multimedia-0/6227132784.jpg			
00-00006573	Comforty 	COMFORTY. Зеркало-шкаф "Страсбург-90" дуб дымчатый	Зеркало-шкаф	8300	11500	Страсбург	900	800	140				ВЛДСП	матовое			Дуб дымчатый			Нет	-	-	-	-	Hettich/Comforty	Hettich/Comforty	-	-	-	Подвесной	Зеркало-шкаф	0,94	0,87	0,21	0,17	21,9	4630100141851	-	-	-	-	-	-	-	-	-	-	-	-	-	-	21,9	-	1	Россия	2 года	Название: Зеркало-шкаф Артикул: Страсбург 90 Цвет: Дуб дымчатый Габариты ШхВхГ: 900х800х140 мм Створка оснащена петлями с механизмом плавного закрывания. Высококачественное зеркальное полотно с амальгамой на основе серебра. Комбинированный фасад из МДФ с горизонтальной фрезеровкой и влагостойкого ЛДСП Дуб дымчатый. За створкой одна горизонтальная полка. Под зеркалом расположена металлическая полочка для размещения предметов для умывания. Зеркало и мебельный элемент два отдельных изделия, поэтому могут быть подвешены, как в правом так и в левом варианте.	https://www.domotex.ru/documents/Manual-Comforty01102019.pdf	0	https://disk.yandex.ru/d/ZvWmkfTDoQBg9w	http://www.domotex.ru/upload/iblock/083/3jv6j9tuurzt4afif38i585monjakt68.jpg	0	https://cdn1.ozone.ru/s3/multimedia-8/6241481960.jpg	https://cdn1.ozone.ru/s3/multimedia-e/6139453322.jpg	https://cdn1.ozone.ru/s3/multimedia-m/6139453330.jpg	https://cdn1.ozone.ru/s3/multimedia-s/6139453336.jpg	https://cdn1.ozone.ru/s3/multimedia-3/6139453347.jpg	https://cdn1.ozone.ru/s3/multimedia-p/6139453369.jpg	https://cdn1.ozone.ru/s3/multimedia-f/6241481931.jpg	https://cdn1.ozone.ru/s3/multimedia-c/6241481928.jpg	https://cdn1.ozone.ru/s3/multimedia-d/6139453357.jpg	https://cdn1.ozone.ru/s3/multimedia-n/6241481039.jpg					
