00-00004767	Comforty 	COMFORTY. Тумба-умывальник "Эдинбург-60-Н" бетон светлый с черной столешницей с отверстием под смеситель, с раковиной COMFORTY 9111	Тумбы-умывальники	22100	30900	Эдинбург	600	950	400				ВЛДСП	матовое	ВЛДСП	матовое	Бетон светлый	Санфарфор	Керамогранит				Нет	черный металл					2 выкатных ящика	Напольный	Тумба	0,46	0,79	0,46	0,23	27,5		Раковина	0,42	0,15	0,42	8.7	0.027		Столешница	0,72	0,07	0,52	13.8			50		3	Россия	2 года	Полуподвесная тумба-умывальник в современном стиле с двумя выкатными ящиками. Ящики оснащены системой плавного закрывания. Тумба укомплектована черными матовыми профильными ручками, столешницей из черного керамогранита и накладной круглой раковиной из санфарфора.   Тумба подготовлена для подключения водоснабжения снизу.  Название: Тумба-умывальник Цвет: бетон светлый Габариты (ШхВхГ): 600*950*400 мм  Комплектация: керамическая раковина Comforty 9111, две ножки, комплект крепления. 	https://www.domotex.ru/documents/Manual-Comforty01102019.pdf		https://disk.yandex.ru/d/hBHjXEvJAlImow	http://www.domotex.ru/upload/iblock/4d4/yernpiotmtv51lo2if50erqlvq712npn.jpg		https://cdn1.ozone.ru/s3/multimedia-s/6404511004.jpg	https://cdn1.ozone.ru/s3/multimedia-1/6404511013.jpg	https://cdn1.ozone.ru/s3/multimedia-z/6404511011.jpg	https://cdn1.ozone.ru/s3/multimedia-2/6404511014.jpg	https://cdn1.ozone.ru/s3/multimedia-u/6404511006.jpg	https://cdn1.ozone.ru/s3/multimedia-y/6404511010.jpg	https://cdn1.ozone.ru/s3/multimedia-0/6404511012.jpg	https://cdn1.ozone.ru/s3/multimedia-3/6404511015.jpg	https://cdn1.ozone.ru/s3/multimedia-v/6404511007.jpg						
00-00010978	Comforty 	Тумба-умывальник "Соло-70" дуб тёмно-коричнвый с раковиной Адриана 70	Тумбы-умывальники	18700	26100	Соло	705	605	450				ВЛДСП	матовое	ВЛДСП	матовое	Дуб темно-коричневый	Санфарфор					Нет	черный металл					2 створки	Подвесной	Тумба	0,72	0,61	0,5	0,22	18		Раковина	0,732	0,202	0,475	17,95	0,07									35,95		2	Россия	2 года	Название: Тумба-умывальник Артикул: Соло 70 Варианты цвета корпуса и фасадов: Дуб тёмно-коричневый Материал корпуса и фасада: влагостойкое ЛДСП Габариты (ШхВхГ): 705*605*450 мм Комплектация: керамическая раковина Адриана 70 Подвесная тумба в современном стиле с двумя створками оснащенными системой плавного закрывания. Для сохранения геометрических размеров конструкция тумбы усилена металлической рамой окрашенной в цвет черный муар. Тумба укомплектована раковиной с прямоугольной чашей и подготовлена для подключения коммуникаций из стены или снизу.  Комплект из тумбы-умывальника и зеркального шкафа Соло-90 может быть дополнен шкаф-колонной Штутгарт 40	https://www.domotex.ru/documents/Manual-Comforty01102019.pdf	http://www.domotex.ru/files/Schema-montazha-Solo70.pdf	https://disk.yandex.ru/d/8XEvMAwWFgqnzg	http://www.domotex.ru/upload/iblock/241/gkn0mlphtf9txo2n6i6jfqircck1ou3l.jpg	https://www.youtube.com/embed/y6AzfjEyGbI	https://cdn1.ozone.ru/s3/multimedia-n/6472502075.jpg	https://cdn1.ozone.ru/s3/multimedia-9/6472502061.jpg	https://cdn1.ozone.ru/s3/multimedia-c/6472502064.jpg	 https://cdn1.ozone.ru/s3/multimedia-p/6472502077.jpg  	https://cdn1.ozone.ru/s3/multimedia-8/6472502060.jpg	 https://cdn1.ozone.ru/s3/multimedia-h/6472502069.jpg	 https://cdn1.ozone.ru/s3/multimedia-o/6472502076.jpg	https://cdn1.ozone.ru/s3/multimedia-q/6472502078.jpg							
00-00011589	Comforty 	Зеркало-шкаф Comforty Соло-70 дуб тёмно-коричневый	Зеркало-шкаф	7500	10400	Соло	680	800	145				ВЛДСП	матовое			Дуб темно-коричневый			нет									1 створка	Подвесной	Зеркало-шкаф	0,755	0,86	0,21	0,136	23	4630100144043					0	0									23		1	Россия	2 года	Название: Зеркало-шкаф Артикул: Соло 70 Варианты цвета корпуса: Дуб тёмно-коричневый Материал корпуса: влагостойкое ЛДСП Габариты (ШхВхГ): 700*800*145 мм Зеркальное высококачественное полотно с амальгамой на основе серебра. За створкой две горизонтальные полки. Зеркальный шкаф универсален, может быть подвешен в левом и правом варианте.  Комплект из тумбы-умывальника и зеркального шкафа Соло-90 может быть дополнен шкаф-колонной Штутгарт 40	https://www.domotex.ru/documents/Manual-Comforty01102019.pdf	0	https://disk.yandex.ru/d/B4JafLylivIK8w	http://www.domotex.ru/upload/iblock/ffb/q6i1st2s44u2duet777uljqgjp1xlvhn.jpg		https://cdn1.ozone.ru/s3/multimedia-z/6472540391.jpg	https://cdn1.ozone.ru/s3/multimedia-r/6472540383.jpg	https://cdn1.ozone.ru/s3/multimedia-p/6472540381.jpg	https://cdn1.ozone.ru/s3/multimedia-q/6472540382.jpg	https://cdn1.ozone.ru/s3/multimedia-n/6472540379.jpg	https://cdn1.ozone.ru/s3/multimedia-o/6472540380.jpg									
00-00011848	Comforty 	Тумба-умывальник Comforty Прага-60 дуб белый с серой столешницей с раковиной Comforty 9055RA-50	Тумбы-умывальники	14900	20800	Прага	600	645	400				ВЛДСП	матовое	ВЛДСП	матовое	Дуб белый	Санфарфор	Керамогранит				Нет						2 выкатных ящика+1 ниша	Подвесной	Тумба	0,64	0,66	0,46	0,19	19,9		Раковина	0,62	0,16	0,72	13,7	0,071		Столешница	0,72	0,07	0,52	13,8	0,026		47,3		3	Россия	2 года	Тумба-умывальник в современном стиле выкатным ящиком и пространством для открытого хранения. Ящик оснащены системой с плавным закрыванием. Тумба укомплектована столешницей и плинтусом из керамогранита и накладной прямоугольной раковиной.   Название: Тумба-умывальник Цвет: Дуб белый Габариты (ШхВхГ): 600*600*400 мм Комплектация: раковина Comforty 9055RA50  Тумба подготовлена для подключения водоснабжения снизу.	https://www.domotex.ru/documents/Manual-Comforty01102019.pdf	http://www.domotex.ru/files/Schema_montazha_Praga_60_9055_2020_4.pdf	https://disk.yandex.ru/d/SVdMI9nWxy9V3Q	http://www.domotex.ru/upload/iblock/ed7/by673lnfzct7fct8j72rcirsbny1wtrk.jpg		https://cdn1.ozone.ru/s3/multimedia-g/6472502104.jpg	https://cdn1.ozone.ru/s3/multimedia-k/6472502108.jpg	https://cdn1.ozone.ru/s3/multimedia-h/6472502105.jpg	https://cdn1.ozone.ru/s3/multimedia-j/6472502107.jpg	https://cdn1.ozone.ru/s3/multimedia-i/6472502106.jpg	https://cdn1.ozone.ru/s3/multimedia-e/6472502102.jpg	https://cdn1.ozone.ru/s3/multimedia-m/6472502110.jpg	https://cdn1.ozone.ru/s3/multimedia-l/6472502109.jpg							
00-00011849	Comforty 	Тумба-умывальник Comforty Прага-60 дуб белый с серой столешницей с раковиной Comforty PZ-6068	Тумбы-умывальники	14000	19600	Прага	600	635	400				ВЛДСП	матовое	ВЛДСП	матовое	Дуб белый	Санфарфор	Керамогранит				Нет						1 выкатной ящик	Подвесной	Тумба	0,64	0,55	0,46	0,16	19,9		Раковина	0,49	0,4	0,16	11,3	0,03		Столешница	0,72	0,07	0,52	13,8	0,026		44,9		3	Россия	2 года	Тумба-умывальник в современном стиле выкатным ящиком и пространством для открытого хранения. Ящик оснащен направляющими с системой плавного закрывания. Тумба укомплектована столешницей и плинтусом из серого керамогранита, а также накладной прямоугольной раковиной.   Название: Тумба-умывальник Цвет: Дуб белый Габариты (ШхВхГ): 600*635*400 мм Комплектация: раковина Comforty PZ-6068 Тумба подготовлена для подключения водоснабжения снизу.	https://www.domotex.ru/documents/Manual-Comforty01102019.pdf	http://www.domotex.ru/files/Schema_montazha_Praga_60_6068_2020_4.pdf	https://disk.yandex.ru/d/PDByuDdcnAeo7w	http://www.domotex.ru/upload/iblock/061/10ihmkdy22km14uxu8y4sc7up5q7ttbw.jpg		https://cdn1.ozone.ru/s3/multimedia-t/6472502117.jpg	https://cdn1.ozone.ru/s3/multimedia-o/6472502112.jpg	https://cdn1.ozone.ru/s3/multimedia-q/6472502114.jpg	https://cdn1.ozone.ru/s3/multimedia-v/6472502119.jpg	https://cdn1.ozone.ru/s3/multimedia-n/6472502111.jpg	https://cdn1.ozone.ru/s3/multimedia-x/6472502121.jpg	https://cdn1.ozone.ru/s3/multimedia-p/6472502113.jpg	https://cdn1.ozone.ru/s3/multimedia-s/6472502116.jpg	https://cdn1.ozone.ru/s3/multimedia-w/6472502120.jpg						
00-00009403	Comforty 	Тумба-умывальник Comforty Бредфорд 90 дуб темный с раковиной Comforty 90E	Тумбы-умывальники	33600	47000	Бредфорд	910	870	465				ВЛДСП	матовое	ВЛДСП	матовое	Дуб темный	Санфарфор					Нет	черный металл					1 ящик	Напольный	Тумба	0,955	0,96	0,53	0,486	46,81		Раковина	0,93	0,5	0,2	19,5	0,093									66,31		2	Россия	2 года	Название: Тумба-умывальник Габариты (ШхВхГ): 910*870*465 мм  Варианты цвета корпуса и фасада: Дуб темный Материал корпуса: влагостойкое ЛДСП Варианты цвета каркаса: черный муар Материал каркаса: сталь  Комплектация: накладная раковина Comforty 90E  Напольная тумба с одним большим выкатным ящиком оборудованным системой плавного закрывания. Фасад и корпус тумбы изготовлены из влагостойкого ДСП, созданного по уникальной технологии «Синхронное тиснение» в декоре «дуб темный». Этот декор при прикосновении дарит ощущение натуральной древесины.  В комплекте керамическая раковина с прямоугольной чашей. В основе тумбы - каркас из стального профиля окрашенный черной эмалью с нижней широкой полкой и средней полкой для полотенец. Стильная ручка ящика в том же цвете что и каркас. Тумба подготовлена для подключения водоснабжения снизу. 	https://www.domotex.ru/documents/Manual-Comforty01102019.pdf	http://www.domotex.ru/files/Schema-montazha-Bredford90_2.pdf	https://disk.yandex.ru/d/yJXQ7IrSv8aIEQ	http://www.domotex.ru/upload/iblock/839/1cl1ycw5cs5ldiwz8zlgn50wwcp2ifwk/153032181666180658.jpg		https://cdn1.ozone.ru/s3/multimedia-s/6472502080.jpg	https://cdn1.ozone.ru/s3/multimedia-2/6472502090.jpg	https://cdn1.ozone.ru/s3/multimedia-6/6472502094.jpg	https://cdn1.ozone.ru/s3/multimedia-3/6472502091.jpg	https://cdn1.ozone.ru/s3/multimedia-i/6472502070.jpg	https://cdn1.ozone.ru/s3/multimedia-x/6472502085.jpg	https://cdn1.ozone.ru/s3/multimedia-r/6472502079.jpg	https://cdn1.ozone.ru/s3/multimedia-g/6472502068.jpg	https://cdn1.ozone.ru/s3/multimedia-v/6472502083.jpg						
00-00010675	Comforty 	Стеллаж подвесной Comforty Порто-50 дуб дымчатый	Дополнительные элементы	12100	16900	Порто	500	1120	240								Дуб дымчатый													Подвесной	Стеллаж	0,32	1,18	0,17	0,64	10,55	4630100143428															10,55		1	Россия	2 года	Стеллаж подвесной «Порто-50» изготовлен из стального профиля, покрытого черной эмалью, полки из ЛДСП цвета дуб дымчатый.  Название: Стеллаж подвесной Варианты цвета: дуб дымчатый Материал: влагостойкое ЛДСП, черный металл Габариты ШхВхГ: 500*1120*240 мм  Для максимального использования пространства в ванной комнате, стеллаж предлагаем располагать справа от тумбы «Порто 120-1», таким образом, чтобы правая часть стеллажа располагалась у боковой стенки тумба, а левая нависала над столешницей. Несомненным плюсом является то, что стеллаж можно повесить в наиболее удобном месте, не загромождая при этом ванную комнату.	https://www.domotex.ru/documents/Manual-Comforty01102019.pdf		https://disk.yandex.ru/d/56vuMb-k-kJL2g	http://www.domotex.ru/upload/iblock/e1c/o47u08o2m03htrftk43dxxepi5zb2y7z.jpg		https://cdn1.ozone.ru/s3/multimedia-f/6472561611.jpg	https://cdn1.ozone.ru/s3/multimedia-i/6472561614.jpg	https://cdn1.ozone.ru/s3/multimedia-3/6472561599.jpg												
00-00011164	Comforty 	Стеллаж для стиральной машины Comforty бетон светлый	Дополнительные элементы	8800	12200		650	1600	465								Бетон светлый						Нет							Напольный	Стеллаж	0,94	0,5	0,13	0,061	18	4630100143961															18		1	Россия	2 года	Напольный стеллаж изготовлен из стального профиля, покрытого черной матовой эмалью, полки из ЛДСП цвета бетон светлый. Стеллаж для установки над стиральной машиной.  Название: Стеллаж напольный Варианты цвета: бетон светлый Материал: влагостойкое ЛДСП, черный металл Габариты ШхВхГ: 650*1600*465 мм  Напольный стеллаж над стиральной машиной дает возможность обеспечить много места для компактного хранения косметических и гигиенических средств, а также украсить интерьер ванной комнаты. Стеллаж поставляется в разобранном виде	https://www.domotex.ru/documents/Manual-Comforty01102019.pdf	http://www.domotex.ru/files/Schema-montazha-Comforty-SM.pdf	https://disk.yandex.ru/d/p0QGmAdTnNfViQ	http://www.domotex.ru/upload/iblock/63f/4vtxoh8qm68cct9ieuspsc6mndh4vc23.jpg		https://cdn1.ozone.ru/s3/multimedia-i/6472561578.jpg	https://cdn1.ozone.ru/s3/multimedia-g/6472561612.jpg	https://cdn1.ozone.ru/s3/multimedia-a/6472561606.jpg	https://cdn1.ozone.ru/s3/multimedia-b/6472561607.jpg											
00-00011201	Comforty 	Стеллаж для стиральной машины Comforty дуб тёмно-коричневый	Дополнительные элементы	9000	12600		650	1600	465								Дуб темно-коричневый						Нет							Напольный	Стеллаж	0,94	0,5	0,13	0,061	18	4630100143978															18		1	Россия	2 года	Напольный стеллаж изготовлен из стального профиля, покрытого черной матовой эмалью, полки из ЛДСП цвета дуб темно-коричневый. Стеллаж для установки над стиральной машиной.   Название: Стеллаж напольный Варианты цвета: дуб темно-коричневый Материал: влагостойкое ЛДСП, черный металл Габариты ШхВхГ: 650*1600*465 мм   Напольный стеллаж над стиральной машиной дает возможность обеспечить много места для компактного хранения косметических и гигиенических средств, а также украсить интерьер ванной комнаты. Стеллаж поставляется в разобранном виде.	https://www.domotex.ru/documents/Manual-Comforty01102019.pdf	http://www.domotex.ru/files/Schema-montazha-Comforty-SM_2.pdf	https://disk.yandex.ru/d/PnwUlPqVq4h0sw	http://www.domotex.ru/upload/iblock/1c4/qdn8dfkpo71uvahjpexpadhxrshx039e.jpg		https://cdn1.ozone.ru/s3/multimedia-n/6472561619.jpg	https://cdn1.ozone.ru/s3/multimedia-m/6472561618.jpg	https://cdn1.ozone.ru/s3/multimedia-j/6472561615.jpg	https://cdn1.ozone.ru/s3/multimedia-k/6472561616.jpg											
00-00011397	Comforty 	Тумба-умывальник Comforty Порто-60 дуб дымчатый с белой столешницей c раковиной Comforty 9111	Тумбы-умывальники	21300	29700	Порто	600	645	400				ВЛДСП	матовое	ВЛДСП	матовое	Дуб дымчатый	Санфарфор	Керамогранит				Нет	черный металл					1 выкатной ящик	Подвесной	Тумба	0,64	0,59	0,46	0,174	20		Раковина	0,42	0,15	0,42	8,7	0,027		Столешница	0,72	0,07	0,52	13,8	0,026		42,5		3	Россия	2 года	Подвесная тумба-умывальник в стиле лофт Порто 60 с одним выдвижным ящиком оснащенным системой плавного закрывания и нижней полкой открытого хранения для полотенец. В основе тумбы - каркас из стального профиля окрашенный в цвет серый графит.  Название: Тумба-умывальник Варианты цвета корпуса и фасада: дуб дымчатый Материал корпуса: влагостойкое ЛДСП Варианты цвета каркаса: серый графит Материал каркаса: сталь Габариты (ШхВхГ): 600*645*400 мм   Комплектация: накладная круглая раковина Comforty 9111, столешница из белого керамогранита. Тумба подготовлена для подключения водоснабжения снизу.	https://www.domotex.ru/documents/Manual-Comforty01102019.pdf	http://www.domotex.ru/files/Schema-montazha-Porto60_2.pdf	https://disk.yandex.ru/d/OBMWf9EIQiS46Q	http://www.domotex.ru/upload/iblock/516/lysci7qjbsuddagace9ikl8yjv6eppk6.jpg		https://cdn1.ozone.ru/s3/multimedia-8/6472502096.jpg	https://cdn1.ozone.ru/s3/multimedia-9/6472502097.jpg	https://cdn1.ozone.ru/s3/multimedia-a/6472502098.jpg	https://cdn1.ozone.ru/s3/multimedia-b/6472502099.jpg	https://cdn1.ozone.ru/s3/multimedia-c/6472502100.jpg	https://cdn1.ozone.ru/s3/multimedia-7/6472502095.jpg	https://cdn1.ozone.ru/s3/multimedia-z/6472502087.jpg	https://cdn1.ozone.ru/s3/multimedia-d/6472502101.jpg							
00-00011395	Comforty 	Тумба-умывальник Comforty Порто-60 дуб дымчатый с белой столешницей c раковиной Comforty 9055RA-50	Тумбы-умывальники	22400	31300	Порто	600	645	400				ВЛДСП	матовое	ВЛДСП	матовое	Дуб дымчатый	Санфарфор	Керамогранит				Нет	черный металл					1 выкатной ящик	Подвесной	Тумба	0,64	0,59	0,46	0.174	20		Раковина	0,55	0,16	0,45	13.7	0.04		Столешница	0,72	0,07	0,52	13.8	0.026		47,5		3	Россия	2 года	Подвесная тумба-умывальник в стиле лофт Порто 60 с одним выдвижным ящиком оснащенным системой плавного закрывания и нижней полкой открытого хранения для полотенец. В основе тумбы - каркас из стального профиля окрашенный в цвет серый графит.  Название: Тумба-умывальник Варианты цвета корпуса и фасада: дуб дымчатый Материал корпуса: влагостойкое ЛДСП Варианты цвета каркаса: серый графит Материал каркаса: сталь Габариты (ШхВхГ): 600*645*400 мм  Комплектация: накладная прямоугольная раковина Comforty 9055RA-50, столешница из белого керамогранита. Тумба подготовлена для подключения водоснабжения снизу.	https://www.domotex.ru/documents/Manual-Comforty01102019.pdf	http://www.domotex.ru/files/Schema-montazha-Porto60-with-9055ra-50_2.pdf	https://disk.yandex.ru/d/T38SzfUIwENreg	http://www.domotex.ru/upload/iblock/6c6/hrhbak4q6k4iw0tib785qzvb0u26rkme.jpg	https://www.youtube.com/embed/Wt6Jrwz8Wuo	https://cdn1.ozone.ru/s3/multimedia-6/6472502058.jpg	https://cdn1.ozone.ru/s3/multimedia-d/6472502065.jpg	https://cdn1.ozone.ru/s3/multimedia-0/6472502088.jpg	https://cdn1.ozone.ru/s3/multimedia-u/6472502082.jpg	https://cdn1.ozone.ru/s3/multimedia-j/6472502071.jpg	https://cdn1.ozone.ru/s3/multimedia-5/6472502093.jpg	https://cdn1.ozone.ru/s3/multimedia-1/6472502089.jpg	https://cdn1.ozone.ru/s3/multimedia-b/6472502063.jpg							
00-00011765	Comforty 	Тумба-умывальник Comforty Милан-120 белая с раковиной Comforty T-Y9378 и серой столешницей GT005	Тумбы-умывальники	32600	45600	Милан	1200	545	520				ВЛДСП	матовое	МДФ	глянцевое	Белый	Санфарфор	Керамогранит				Нет	Хром					2 выкатных ящика	Подвесной	Тумба	1,24	0,47	0,58	0,038	43,2		Раковина	0,43	0,52	0,16	11,52	0,036		Столешница	1,33	0,07	0,71	39,5	0,066		94,22		3	Россия	2 года	Широкая подвесная тумба-умывальник в современном стиле с двумя выкатными ящиками. Ящики оснащены системой с плавным закрыванием. За правым фасадом скрывается внутренний ящик оснащенный системой push-to-open (открытие при нажатии). Тумба укомплектована столешницей и плинтусом из серого керамогранита и накладной прямоугольной раковиной. Фасады покрыты белой глянцевой эмалью.  Тумба подготовлена для подключения водоснабжения снизу.  Название: Тумба-умывальник Цвет: белый глянец Габариты (ШхВхГ): 1200*545*520 мм Комплектация: раковина Comforty T-Y9378	https://www.domotex.ru/documents/Manual-Comforty01102019.pdf	http://www.domotex.ru/files/Schema_montazha_Milan_120_2020_4.pdf	https://disk.yandex.ru/d/Bo8iPZADvZ3ROQ	http://www.domotex.ru/upload/iblock/f23/vipmcih24cutqqrggxkgkyib70he1y5c.jpg		https://cdn1.ozone.ru/s3/multimedia-e/6472502066.jpg	https://cdn1.ozone.ru/s3/multimedia-f/6472502067.jpg	https://cdn1.ozone.ru/s3/multimedia-k/6472502072.jpg	https://cdn1.ozone.ru/s3/multimedia-l/6472502073.jpg	https://cdn1.ozone.ru/s3/multimedia-a/6472502062.jpg	https://cdn1.ozone.ru/s3/multimedia-5/6472502057.jpg									
